{
  "protocol_revision": "mina.analyze/2026-08-21",
  "message_id": "019f49e0-3400-7a11-8c20-2f4fb6f8a901",
  "message_type": "knowledge_request",
  "created_at": "2026-08-21T21:00:00Z",
  "issuer": {
    "type": "project",
    "id": "development-portfolio"
  },
  "payload": {
    "request_id": "019f49e0-3400-7a11-8c20-2f4fb6f8a901",
    "capability": "analyze",
    "idea": {
      "statement": "Incorporar un workspace cognitivo de MINA dentro del panel Filament de Development Portfolio reutilizando, cuando sea coherente y autorizado, la implementación Vue observada en Floulabs.",
      "origin_reference": "diamont:experiment:mina-analyze-portfolio-filament"
    },
    "shared_understanding": {
      "status": "sufficient_for_analysis",
      "statements": [
        "Filament conserva autenticación, navegación global y layout exterior.",
        "Vue debe permanecer aislado del árbol React de Mission Control.",
        "MINA selecciona conocimiento; el frontend no contiene el Patrimonio ni concede approvals.",
        "La reutilización no implica copiar la carpeta /console completa."
      ],
      "uncertainties": [
        "Licencia y redistribución de módulos mt-vendor no confirmadas.",
        "Costo productivo de mantener React y Vue en el mismo proyecto no medido.",
        "Context-Bound Operational Authority todavía no es un Crystal activo."
      ]
    },
    "project_context": {
      "project_id": "development-portfolio",
      "objective": "Presentar solicitudes y resoluciones MINA dentro del gobierno operativo existente de Portfolio.",
      "scope": [
        "Laravel 13",
        "Filament 5 Custom Page",
        "Vue workspace aislado",
        "server-authored bootstrap",
        "MinaResolution read-only"
      ],
      "out_of_scope": [
        "reemplazar Filament",
        "modificar Mission Control React",
        "copiar dominios Floulabs",
        "ejecutar Suggested Actions",
        "escribir en el Patrimonio",
        "cristalizar automáticamente"
      ],
      "constraints": [
        "Portfolio usa React 19 y Vite 8 para Mission Control.",
        "La página debe respetar sesión y autorización Filament.",
        "No se pueden distribuir assets con licencia no confirmada.",
        "Portfolio persiste referencias y gobierno, no conocimiento autoritativo."
      ],
      "authorized_references": [
        "diamont:study:floulabs-context-bound-operational-authority",
        "diamont:study:floulabs-vue-operational-console-materialization",
        "portfolio:feature:OPS-F34"
      ]
    },
    "execution_intent": {
      "mode": "analyze",
      "purpose": "Descubrir el Crystal Set, la materialización reusable, las adaptaciones y los gaps antes de diseñar o implementar la página Filament.",
      "target_reference": "portfolio:filament:mina-workspace",
      "expected_outcome": "explainable_knowledge_resolution"
    },
    "actor_capability": {
      "role": "software_architecture_worker",
      "can_interpret": [
        "structured_json",
        "markdown"
      ],
      "can_execute": false
    },
    "authority_context": {
      "allowed": [
        "read_knowledge",
        "receive_proposal"
      ],
      "prohibited": [
        "execute",
        "external_search",
        "write_patrimony",
        "crystallize"
      ]
    },
    "knowledge_policy": {
      "maximum_classification": "project_shared",
      "external_search": false,
      "include_materializations": "references_only"
    }
  },
  "integrity": {
    "canonicalization": "jcs-rfc8785",
    "algorithm": "sha256",
    "payload_digest": "sha256:7bc1c89e4e4eaf3bc87415f14d862df08427244e91e6c0d05a0402f9a0f9fc4c"
  }
}
